TrendID,TrendName,TrendDescription,TrendStartDate,TrendEndDate,ProductID,MarketSegment,Region,SalesImpact,ConsumerFeedback,TrendData
137,Health Monitoring,Former walk live should positive finally forget.,28/04/2021,28/01/2022,7,Home Appliances,South America,11.11,Significant similar hold.,Sister participant course risk so across.
138,Cloud Gaming,Poor security her space speech.,12/11/2021,08/07/2023,19,Office Supplies,Asia,-90.24,Write green center.,Appear beat ahead hundred.
139,High-resolution Displays,Force blue situation catch worker like.,22/06/2023,11/10/2023,19,Consumer Electronics,Africa,-30.23,Sense seem think building rock.,Notice how report statement scene important.
140,Sustainable Manufacturing,Organization college least type design total my.,01/09/2023,26/02/2024,48,Office Supplies,Europe,65.1,Nice art know against season allow.,Laugh reach themselves.
141,High-resolution Displays,Action stand well growth.,27/12/2020,06/12/2022,2,Home Appliances,Asia,-73.89,Water relationship note.,Manage or continue wait nice president.
142,Portable Power Solutions,Event various though who.,05/01/2024,28/04/2024,6,Automotive,Europe,48.21,Present together person when throughout.,Technology wonder individual.
143,AI-driven Devices,Face station between always cold term involve.,12/08/2021,03/08/2023,9,Fitness,Europe,-5.82,Color magazine hand allow whose cause tonight.,Hotel possible suffer certain six.
144,High-resolution Displays,Sometimes not statement term seek.,17/11/2023,07/06/2025,31,Consumer Electronics,South America,-66.28,Ten official rate language high around land.,Enjoy media see today cell short individual.
145,Home Automation,Well chair white public American education control.,21/08/2021,26/01/2022,25,Automotive,Europe,4.23,Idea how wish.,Room about cup affect if second room.
146,Health Monitoring,Reduce education bad bar.,05/03/2024,18/08/2025,11,Gaming,Asia,48.68,Rate water our.,Explain actually industry fact training would toward.
147,Smart Appliances,Every western simply recent despite someone spring drop.,10/09/2021,31/05/2022,50,Home Appliances,Africa,29.17,Sea somebody any head miss.,Religious pay arm fear.
148,Wearable Fitness Trackers,Daughter treatment after number between.,11/08/2020,16/11/2020,23,Fitness,Oceania,28.67,Thank pressure budget usually.,Rich school interest plan.
149,5G Connectivity,Risk understand according data.,22/09/2021,03/02/2023,36,Consumer Electronics,North America,1,For stand bit speak.,Fine answer moment citizen design real very.
150,Health Monitoring,Owner foot marriage stock.,17/03/2021,14/06/2021,29,Fitness,Africa,29.04,Compare by summer follow no toward word land.,Open safe issue your help.
