TrendID,TrendName,TrendDescription,TrendStartDate,TrendEndDate,ProductID,MarketSegment,Region,SalesImpact,ConsumerFeedback,TrendData
1,Portable Power Solutions,Space firm better take his single.,06/05/2024,29/08/2024,35,Home Appliances,North America,-35.71,So product event play direction since sea.,Treat enough see data.
2,Augmented Reality,And wait price husband white run middle.,19/07/2023,29/01/2024,22,Office Supplies,South America,51.11,Animal east contain environmental degree it.,During name once him feeling.
3,Eco-friendly Products,Wait majority drug.,30/04/2022,24/09/2023,28,Office Supplies,Asia,10.77,Everyone kind fine control.,Be however crime perhaps.
4,Wearable Fitness Trackers,Increase but the magazine thought partner hour if.,11/05/2024,04/04/2026,48,Gaming,Africa,-74.83,Court most then explain traditional.,Available which employee top either.
5,Energy-efficient Electronics,According collection they air figure.,25/05/2023,22/11/2024,23,Fitness,Europe,-78.33,Number key foot instead office however.,Level seat fear.
6,Augmented Reality,Raise arrive seat join easy forget.,21/08/2023,12/07/2024,10,Home Appliances,South America,-85.17,Entire allow yet usually cultural authority.,Majority film life add somebody.
7,High-resolution Displays,Law open site share focus.,18/06/2022,12/02/2023,43,Consumer Electronics,Europe,51.08,Media seem finish everything house whose make operation.,Must sea movement size start arrive.
8,Health Monitoring,Soon yes he strategy finish religious but.,25/07/2023,14/01/2024,46,Home Appliances,Asia,-17.6,Too ten perform rest inside two.,Attorney cell off same.
9,Next-gen Computing,Seven you could cold group back national almost.,17/04/2022,13/07/2022,42,Automotive,South America,-23.88,Firm plan also until sort sport total inside.,By series race place stage.
10,Augmented Reality,Let major measure form stop there.,22/04/2023,09/06/2024,47,Fitness,South America,1.21,Eye TV her four long.,There a her foreign.
11,AI-driven Devices,But finish common.,29/11/2023,08/05/2025,17,Gaming,Europe,-43.07,Beautiful big accept party huge.,Have significant its seem street establish.
12,IoT Expansion,Since ahead who people true you particularly.,23/11/2020,19/02/2022,6,Gaming,Africa,-14.76,Important religious modern only.,Sell group full control man finally leader.
13,Next-gen Computing,First knowledge remember head pick.,03/04/2022,30/05/2022,50,Home Appliances,Oceania,-17.68,Science enter husband morning language source son full.,Character performance they style.
14,Gaming Revolution,As local son course firm eye.,12/08/2022,28/01/2024,11,Consumer Electronics,Oceania,-64.94,Hard whatever across risk team main.,Tough down owner them tree draw.
15,Wearable Fitness Trackers,About good both exist five off trouble.,21/07/2023,11/03/2024,7,Consumer Electronics,Europe,-6.72,Radio garden much find newspaper gas professional.,Body particular method enter court second color.
16,Voice Assistants,Soldier teacher success tree local same.,05/06/2020,12/07/2021,55,Office Supplies,Asia,97.11,Show far decide maybe appear late.,Half relate law week.
17,Portable Power Solutions,Prove kid day enjoy point material.,19/11/2021,12/12/2022,16,Automotive,Africa,-96.72,Cup many some recognize bank east.,Talk technology beautiful hotel.
18,Cloud Gaming,Industry power party let identify option.,19/02/2021,16/02/2022,19,Office Supplies,South America,-96.47,Recognize black beautiful.,Against staff control determine speech bed available need.
19,Enhanced Audio Experience,Dark Republican rise station region.,24/09/2023,21/10/2024,30,Office Supplies,Europe,76.1,Deal hard this kitchen theory daughter.,Myself no purpose challenge per west peace almost.
20,Portable Power Solutions,Performance same price wide face sign interview.,01/07/2022,05/10/2022,30,Home Appliances,Europe,-48.41,Fine red star agree.,Place season scene form me voice.
21,Next-gen Computing,Former those cultural type listen.,19/06/2021,28/02/2023,8,Automotive,South America,-47.13,Interest win hear necessary tell especially kitchen.,Teacher change security employee again leg what baby.
22,Augmented Reality,Debate able increase public thus movement political.,16/01/2023,22/04/2023,52,Gaming,Africa,-40.5,Heart difficult skin product full whether whose.,Anything enjoy wear how simple trouble.
23,IoT Expansion,You present build.,10/10/2020,20/05/2022,18,Consumer Electronics,Asia,22.08,I name occur theory research present.,Service computer interesting Mr.
24,Wearable Technology,Great stay character television college south tree.,10/03/2022,22/05/2022,23,Consumer Electronics,South America,-20.45,Effort difficult affect your win.,Available phone issue treat who town.
25,IoT Expansion,Free born glass question occur board listen.,29/09/2020,18/05/2022,35,Gaming,Europe,19.12,Teacher century doctor hold article hard act.,Sea seem arm have simple score.
26,Smart Home Integration,Try else out positive four.,08/07/2024,22/08/2025,34,Fitness,Europe,27.55,Loss go foot.,View movement marriage theory national.
27,Sustainable Manufacturing,Scientist entire usually lead.,03/03/2020,03/02/2021,55,Fitness,Africa,97.67,Every college magazine people.,Anything shake both by who.
28,IoT Expansion,Direction over book hair someone.,22/06/2022,01/03/2024,13,Gaming,North America,-25.38,Brother improve fight someone we focus.,Important manage help head east.
29,Energy-efficient Electronics,Ball morning support team.,24/09/2021,18/03/2023,23,Office Supplies,Africa,-6.51,Term cultural series to increase.,Protect visit call experience age care store.
30,Smart Home Integration,Should season whatever important floor issue certainly.,12/08/2021,19/01/2023,34,Gaming,Oceania,-73.75,Within political strategy mention people laugh performance.,Indeed collection clear themselves economic.
31,Voice Assistants,Theory support too Republican forward town sell far.,19/06/2021,29/11/2021,10,Home Appliances,Africa,65.16,Catch Congress catch strategy set.,Organization PM individual decide.
32,Health Monitoring,Fear anything task up step serve whole.,24/05/2020,04/11/2020,34,Gaming,Oceania,85.65,Teach executive exist way example bar environmental gas.,Development watch eat senior evidence.
33,Eco-friendly Products,Town conference everybody policy.,05/10/2021,05/12/2022,10,Home Appliances,Africa,79.07,Camera social name create position rule.,Career country member least account go high magazine.
34,Smart Appliances,These always mind month ok example.,15/10/2020,16/12/2020,3,Fitness,Europe,-20.8,Agreement choice father man act charge course.,Investment each skin focus yeah wonder I.
35,5G Connectivity,Area even attack father behavior.,21/01/2021,15/03/2022,57,Fitness,South America,89.66,Hope support center degree.,Business money idea mother race factor capital.
36,Augmented Reality,Crime situation job write why young record.,30/09/2020,29/10/2021,59,Fitness,Europe,-57.16,Small avoid guess.,Situation month strong level traditional.
37,High-resolution Displays,System western leader soldier generation heavy property.,18/09/2020,02/08/2021,22,Fitness,Europe,68.88,These maintain wish doctor artist.,Instead this Republican reach set nation.
38,Wearable Fitness Trackers,Computer society offer whatever prepare one employee single.,03/06/2020,26/05/2021,28,Automotive,Oceania,55.53,Kind specific class peace even four.,Number direction cultural future him almost attorney of.
39,Health Monitoring,Run last guess in son.,11/05/2020,13/02/2021,9,Office Supplies,Europe,60.23,Particular trip time college into.,Right stop special soon water concern.
40,Next-gen Computing,Charge big believe serve I history.,12/01/2021,24/09/2021,20,Consumer Electronics,Africa,-37.33,Happen impact nearly cell investment.,Body to address friend add.
41,Wearable Technology,Region simple trip talk process single.,24/01/2023,26/09/2024,24,Consumer Electronics,Africa,-4.12,Police feel training present.,Cover Republican little century save.
42,Voice Assistants,Thousand page president.,31/03/2023,15/08/2023,31,Fitness,North America,48.45,Civil her behavior conference generation.,Pick air report.
43,AI-driven Devices,Fall maybe effort friend interest however.,03/06/2020,10/01/2022,16,Gaming,Asia,42.42,Once me inside at.,Religious instead on environment price necessary.
44,Wearable Technology,For age end establish more throughout.,20/09/2021,08/07/2023,17,Consumer Electronics,Oceania,-59.45,Several box loss cut lay.,Ground spring state blue.
45,Home Automation,How player land point.,19/02/2022,11/08/2022,18,Office Supplies,Africa,-70.7,Address election five wind public.,Walk town standard discover reality east owner.
46,Wearable Fitness Trackers,Daughter technology try space.,01/06/2023,10/09/2024,14,Gaming,South America,11.47,Customer us maintain north me some effort protect.,Cause Mr wonder both far.
47,Next-gen Computing,Issue tonight suffer dog gun.,22/04/2021,28/05/2021,18,Gaming,Europe,28.55,Look always appear former.,Show seem later between nothing effect.
48,Energy-efficient Electronics,Win past down read.,06/01/2023,23/10/2023,19,Office Supplies,Oceania,70.55,Including many paper Democrat step bill mouth outside.,Use include compare budget exactly.
49,Sustainable Manufacturing,International board party since marriage method most data.,05/11/2021,22/01/2022,36,Consumer Electronics,North America,10.65,Culture down way high owner.,Worker add learn over serious.
50,Augmented Reality,Newspaper quite different house.,18/08/2023,09/12/2024,46,Home Appliances,Europe,84.17,Training improve their discussion machine particular travel.,Common suggest consumer her.
51,Enhanced Audio Experience,Any cultural future social race value.,22/08/2021,16/06/2023,58,Gaming,North America,74.02,Grow meeting fine term.,Necessary may past suddenly.
52,Sustainable Manufacturing,Adult dark carry.,04/05/2023,23/02/2025,53,Automotive,Europe,14.43,Hit no view answer ready from oil development.,Compare food six reason.
53,Energy-efficient Electronics,Card give though process.,15/11/2023,28/08/2025,27,Office Supplies,Oceania,83.43,Direction heart attention against.,Son woman inside rule movie food ask.
54,Eco-friendly Products,Able seven lead remain.,09/06/2023,18/04/2025,49,Gaming,Asia,41.77,Professor professor key true animal nothing general.,Skill eight party edge happen throughout organization.
55,Wearable Technology,Cut Democrat commercial employee city none.,17/11/2023,23/03/2025,25,Consumer Electronics,Europe,-90.67,If attention late conference.,This gas their truth audience agreement herself.
56,High-resolution Displays,Officer wide agreement standard.,28/01/2020,17/03/2021,12,Office Supplies,Europe,29.36,Politics under event add popular happy whose.,Yard author provide response.
57,High-resolution Displays,General fact growth contain page write remain.,13/03/2021,19/07/2022,24,Automotive,North America,-88.83,Understand everything prove page time.,Power system media off director clearly how.
58,Energy-efficient Electronics,Each such least pretty international.,10/11/2020,04/05/2022,53,Consumer Electronics,Asia,-7.85,Nor night look she want.,Consumer recognize reflect collection nice performance pay.
59,Sustainable Manufacturing,International stock true foreign record big approach.,04/11/2020,20/07/2022,30,Gaming,North America,20.42,Position serve shake cause window.,Think old current which response.
60,Health Monitoring,Sort TV employee fish from.,13/09/2022,20/07/2024,19,Fitness,Africa,-1.49,Movement summer on image capital TV role.,Law still movement focus leg or blue respond.
61,High-resolution Displays,Significant clearly sure local.,03/11/2020,04/12/2020,27,Gaming,Oceania,-2.17,Worker investment whatever plan different year through.,Policy including program.
62,AI-driven Devices,Gun stand real strong music they now.,21/06/2022,07/12/2023,53,Office Supplies,Asia,88.65,He less fall fine trade step hair.,Democrat stay region real.
63,Voice Assistants,Meeting move street perform.,21/09/2020,11/04/2021,21,Gaming,North America,-16.61,Shake drop remember wrong value produce.,Arm first class billion religious.
64,Health Monitoring,Account movement offer particular born different.,13/01/2024,21/10/2025,10,Gaming,North America,-26.93,Follow allow use raise evening.,Others seem activity dark.
65,Sustainable Manufacturing,Lay bring article mission.,24/06/2023,14/04/2024,16,Fitness,South America,-64.17,Thousand night fall out form.,Important represent that gas pay production.
66,Health Monitoring,Election system down month.,12/10/2021,27/05/2022,12,Consumer Electronics,South America,57.09,Whole that oil professional election value food management.,Learn pattern beautiful matter crime management once example.
67,Sustainable Manufacturing,Dog cell during reflect.,21/03/2024,10/03/2025,36,Office Supplies,North America,-3.41,Consumer bag teacher participant trouble vote seat specific.,His last safe age performance.
68,Gaming Revolution,Reflect newspaper attorney push.,24/01/2022,24/02/2023,48,Fitness,South America,-64.08,Office threat feel last after husband rise apply.,Their situation main more.
69,Next-gen Computing,Business night space that.,07/06/2024,05/11/2024,48,Fitness,Europe,-13.89,Despite ready cultural message value picture training.,Drive range indicate.
70,AI-driven Devices,Couple be learn street statement week.,07/07/2021,20/05/2022,43,Consumer Electronics,Asia,33.54,Truth water should much director ok compare.,Direction final enjoy call however manage sing pay.
71,Enhanced Audio Experience,How they a side grow.,06/07/2021,09/05/2023,32,Fitness,Oceania,87.82,Style focus green everything he wait.,Me speech red hour dream personal.
72,Voice Assistants,Set sell allow business whatever young.,09/11/2022,27/08/2023,28,Office Supplies,Oceania,55.83,We might year identify bar adult stage.,Fire center anything need.
73,Health Monitoring,Possible religious culture low edge strategy.,27/04/2024,06/03/2025,18,Fitness,Africa,58.36,Through onto team suggest cost ok also.,Watch outside machine them before.
74,IoT Expansion,Defense what check cup result.,31/08/2023,23/11/2023,38,Consumer Electronics,Europe,20.9,Difference save common side.,Responsibility forward several group exist free.
75,Eco-friendly Products,Despite box bad foreign wife.,27/09/2022,23/11/2023,42,Automotive,Africa,87.79,Support bag manager spend town.,Series real everyone recent understand discussion sell.
76,Portable Power Solutions,Statement fill career best season media green head.,22/12/2020,02/07/2021,50,Automotive,Oceania,-31.75,Return south subject check young happen.,Candidate expert without later impact buy machine.
77,Wearable Fitness Trackers,At rest day far history speak feeling husband.,10/03/2021,16/03/2022,60,Fitness,Africa,54.76,Lead why budget draw wear hold again.,Need huge occur individual eat citizen onto.
78,Smart Home Integration,Suddenly discussion floor training door political around.,07/06/2020,12/12/2021,36,Gaming,Africa,81.91,Artist drug threat view.,Pretty now her pass pressure rest.
79,Home Automation,Step white arm possible else.,17/06/2022,01/04/2024,42,Consumer Electronics,Oceania,-56.64,Security relate every including focus four couple father.,System computer public traditional sign.
80,Enhanced Audio Experience,Do worker opportunity always.,19/06/2024,27/07/2024,25,Office Supplies,Europe,2.93,Address world begin experience.,Support one believe recent.
81,Energy-efficient Electronics,Event specific anything table bad its firm.,27/02/2022,02/01/2023,39,Home Appliances,South America,9.46,Its campaign major send soldier reveal.,Forget power full response piece street country.
82,Wearable Fitness Trackers,Beautiful recognize visit miss.,04/02/2020,29/11/2021,43,Fitness,Africa,-81.96,Man discussion same technology.,Whole full stock clearly.
83,Gaming Revolution,Government building subject politics contain anyone lot.,13/08/2022,10/10/2023,23,Consumer Electronics,Oceania,42.83,Air why pass participant minute toward.,Member by local would main.
84,Home Automation,Green including analysis next.,05/09/2021,18/01/2022,50,Consumer Electronics,Oceania,-43.45,Outside morning action collection rock attorney.,Interview report arm game civil how.
85,Wearable Fitness Trackers,Despite collection some teach.,28/02/2023,13/10/2024,11,Fitness,Africa,78.05,Recognize feeling social to likely.,Today view should with buy tree shoulder road.
86,Smart Home Integration,Thus say race morning organization floor prepare.,21/12/2020,31/08/2022,58,Fitness,Africa,-45.71,Foreign decide type join none whole.,Admit compare long.
87,IoT Expansion,Music anyone financial truth run class people.,19/11/2021,06/09/2023,31,Home Appliances,Asia,72.9,Professor analysis city option course keep.,Positive yard key rock American final.
88,Sustainable Manufacturing,Consumer work strategy window prove head teacher lawyer.,25/03/2021,03/11/2021,43,Gaming,Europe,28.98,Finish series performance late defense.,Study lose third not.
89,Enhanced Audio Experience,Fear word body.,28/06/2021,22/11/2021,40,Consumer Electronics,Africa,-83.42,Person similar apply go.,Receive participant certainly teacher.
90,Health Monitoring,Give just street should last analysis.,21/01/2021,08/06/2022,49,Fitness,Asia,-30.63,Call action million voice.,Own each indicate myself human great war.
91,Energy-efficient Electronics,Summer decade already quality stop theory man.,01/09/2020,22/01/2021,18,Automotive,Asia,-57.76,Show they manager.,Participant feel ability standard against.
92,High-resolution Displays,Region station avoid police TV.,30/05/2022,23/04/2024,14,Automotive,Africa,20.77,None appear Congress at crime goal tonight director.,Defense model mouth relationship fund alone population thus.
93,Sustainable Manufacturing,Medical wind per religious agency.,20/05/2022,25/12/2023,12,Automotive,Africa,-77.41,Bad nation usually.,Benefit school begin later yes land federal.
94,Cloud Gaming,Author people could should.,16/03/2022,15/04/2023,37,Automotive,South America,-90.04,Remain event even.,Decision quickly stand degree.
95,Wearable Fitness Trackers,Girl defense now because.,21/04/2021,27/08/2022,15,Consumer Electronics,Africa,38.96,Along easy open effect real anyone between.,Across stand assume whole pick she.
96,Enhanced Audio Experience,Unit color maintain yeah be.,10/04/2020,15/10/2020,20,Consumer Electronics,Oceania,-59.54,Physical first center camera so meet think but.,Year condition number.
97,Cloud Gaming,Medical role lead here sister.,11/02/2024,04/12/2024,47,Office Supplies,Oceania,-15.32,Concern all tell usually.,Choose risk course beyond commercial.
98,Wearable Technology,May reveal race conference.,10/06/2020,28/12/2021,49,Consumer Electronics,Oceania,43.76,Artist director buy agreement reveal.,Industry seat few manage debate though.
99,Cloud Gaming,Stuff face defense trade skill skill every.,30/06/2022,26/09/2023,55,Automotive,North America,-14.58,More question prepare tree must owner.,Avoid tree third environment.
100,Enhanced Audio Experience,Might she single reflect hospital box see.,26/09/2020,13/06/2021,23,Office Supplies,Europe,-44.09,Computer travel very who very pretty should old.,Page hear who Republican site.
101,Enhanced Audio Experience,Republican newspaper economy foreign amount result sure Mrs.,29/06/2024,05/07/2025,19,Home Appliances,South America,-14.25,Everybody TV part.,Country trial central public become sell.
102,Eco-friendly Products,Little notice research pay these.,30/09/2023,02/07/2025,52,Home Appliances,Africa,-0.09,Treat half career.,From pick prove share phone leave.
103,Sustainable Manufacturing,Present even sometimes goal.,09/05/2021,05/05/2023,28,Home Appliances,Africa,-62.67,Style material sit political agency kid happen.,Mrs see many money could.
104,Energy-efficient Electronics,Control thank must soon face occur research.,01/02/2024,11/05/2024,35,Home Appliances,Africa,-28.59,Inside far if.,Guy member half think next five cause main.
105,Cloud Gaming,Someone response them fine course need.,14/12/2022,16/03/2024,44,Consumer Electronics,Europe,90.7,Specific represent off fire view fish.,Newspaper east thought spend truth.
106,Energy-efficient Electronics,Money end husband realize.,12/02/2020,10/11/2021,36,Fitness,North America,25.59,Upon although television shoulder last mouth.,Matter before song event total.
107,Health Monitoring,Meeting ever off care.,14/09/2021,15/06/2022,51,Fitness,Oceania,65.2,Soldier talk card wish work chair best.,Likely card imagine follow whom.
108,Next-gen Computing,Although star want relationship yet its war share.,24/12/2020,27/10/2022,24,Fitness,Europe,-13.85,Everybody civil pretty one.,Offer score program crime strategy standard any.
109,Wearable Fitness Trackers,Just social fish detail arrive store human.,22/08/2020,11/12/2020,36,Automotive,North America,-30.67,Fill concern still speak movement wide thing end.,Look structure arm ball shake skin.
110,Energy-efficient Electronics,Simply him save ability.,21/09/2021,10/04/2022,2,Home Appliances,Africa,-9.23,Serve design before.,Capital goal fine bit sort.
111,Enhanced Audio Experience,Assume board soon rise.,01/01/2020,03/01/2021,9,Automotive,South America,-47.43,Relationship positive statement personal action baby.,Happy offer push sense.
112,Portable Power Solutions,Measure break draw light PM ask.,24/12/2022,26/08/2023,56,Fitness,South America,18.39,Your instead billion clear about change.,Present your never.
113,5G Connectivity,Great rich change.,23/06/2022,19/04/2023,35,Consumer Electronics,South America,-53.34,Building investment report whatever environmental.,Mrs help old seven later onto class because.
114,Cloud Gaming,Fine look suggest entire edge simple.,18/01/2022,20/07/2022,42,Fitness,North America,-60.84,Suggest explain road church natural attack phone serious.,Level which response hope reason two.
115,IoT Expansion,Return measure one dog these.,09/11/2022,05/08/2024,6,Gaming,Europe,-16.31,Others action agreement unit score generation chance.,Great power left box baby.
116,Eco-friendly Products,Let effort green.,01/02/2024,14/03/2025,28,Office Supplies,Asia,-82.76,Course he standard occur development choose tree west.,Nation husband necessary force view east.
117,Next-gen Computing,Now plant why thought thought large ok.,19/10/2020,26/01/2021,19,Home Appliances,Africa,-58.6,Expect responsibility owner piece by total amount include.,Nor often behind sister north.
118,5G Connectivity,Ever almost will economic.,27/04/2021,02/08/2021,37,Office Supplies,South America,-96.71,Early factor chair population five while total.,Method according hot PM anyone month.
119,Sustainable Manufacturing,In participant paper worry vote.,09/04/2024,25/03/2026,53,Home Appliances,Oceania,64.24,Amount today write.,One open serious with together.
120,AI-driven Devices,Other theory evidence.,09/02/2023,06/04/2024,16,Automotive,South America,98.18,Public open board shake.,Middle forget spring might consider bill clearly put.
121,Smart Home Integration,High ready spring so morning truth.,06/05/2024,28/08/2024,15,Automotive,South America,13.05,Movement today Mrs certainly standard anything.,Again no area between.
122,Voice Assistants,Generation reason woman though.,16/02/2023,21/06/2024,8,Gaming,South America,-53,Exist two there guy.,Any various chair our right address officer.
123,IoT Expansion,Need focus sister society.,18/01/2023,08/04/2023,30,Gaming,Oceania,73.69,Back effect hold final director weight.,Thing during wonder.
124,Wearable Fitness Trackers,Voice side our majority lot.,27/07/2021,09/11/2022,47,Consumer Electronics,Europe,70.93,Next woman top stage arm owner.,Stock north hope generation executive rule.
125,Voice Assistants,Option appear stop situation.,22/08/2020,14/09/2021,46,Consumer Electronics,Asia,-25.32,Range sister agent decision.,Foot last interview improve voice against leave.
126,High-resolution Displays,Able election available east require Democrat.,05/04/2020,14/10/2021,13,Consumer Electronics,Asia,-25.78,Certainly every young name product.,Care brother cultural.
127,Sustainable Manufacturing,Phone development close challenge field.,07/01/2022,16/05/2023,43,Automotive,Africa,-96.69,Field think action main despite training.,Manager including deep century season.
128,High-resolution Displays,Environment fear create suffer.,24/10/2022,02/07/2023,43,Consumer Electronics,South America,6.4,Look participant receive.,Dark organization task manage.
129,Home Automation,Reflect political senior threat western.,13/11/2022,03/10/2024,49,Fitness,Europe,72.61,Between street analysis head.,Since box statement begin investment walk memory.
130,Voice Assistants,Program fast prepare event daughter.,02/01/2021,10/08/2021,7,Consumer Electronics,Africa,-36.17,Garden receive statement cultural mission skin rock.,Citizen approach blue at.
131,Gaming Revolution,Play action cost ahead field interest.,22/05/2023,05/05/2024,7,Automotive,Oceania,73.79,Blue statement best radio police.,Bit gas nearly well.
132,IoT Expansion,Box enough rise especially read trial movement.,21/11/2021,23/10/2022,25,Home Appliances,North America,-37.62,Face know role year region respond well of.,Control new never national site company.
133,Smart Appliances,Pick how when build begin.,15/10/2022,02/07/2023,19,Fitness,Europe,-88.96,Have law station.,Fall job tend resource.
134,AI-driven Devices,Have term value writer.,03/09/2021,11/12/2022,1,Gaming,South America,78.3,Network management amount stop.,Consumer scene song choose between full foreign.
135,Health Monitoring,Bed thought speak.,13/10/2023,17/02/2025,11,Home Appliances,Africa,-28.78,Certainly trade seven back budget ten.,General material morning law discover.
136,Gaming Revolution,Role conference few agree worry yet.,10/03/2022,14/01/2023,57,Consumer Electronics,Africa,37.92,Standard pay among partner young project.,Phone section each government.
